{
  "accuracy_metrics": {
    "fp32_max_abs_error_layer3_npu_vs_cpu": 1.907e-05,
    "tile_memory_used_bytes_layer2": 37248,
    "tile_memory_used_bytes_layer3": 41344
  },
  "calibration_data_id": "synthetic_seed20260425_n1_T2000",
  "degradation_vs_fp32": {
    "int8_pending_t6_1": 0.0
  },
  "generated_at_iso8601": "2026-04-25T04:35:00Z",
  "hardware_signature": "x86_64;Ryzen-AI-9-HX-370;npu=AIE2P;6x8",
  "host": "matteius-ProArt-P16-H7606WI",
  "model_name": "dorado_fast_conv_stem_layer2_layer3",
  "model_sha256_fp32": "89c9a81eb261d3243de001fd947c6b1e728d8867a23b4ea4924636f0191b1363",
  "model_sha256_quant": "89c9a81eb261d3243de001fd947c6b1e728d8867a23b4ea4924636f0191b1363",
  "n_samples": 1,
  "precision": "int8",
  "schema_version": "1.0.0",
  "strategy": "per_channel"
}
